{
  "$schema": "https://miri-whl.github.io/schemas/migration-guide-v1.json",
  "from_version": "1.0.0",
  "to_version": "1.1.0",
  "migration_type": "minor",
  "generated_at": "2026-09-20T00:00:00Z",
  "summary": {
    "breaking_changes": 0,
    "new_features": 0,
    "deprecations": 0,
    "estimated_migration_time": "0 minutes"
  },
  "deprecations": [],
  "breaking_changes": []
}
